{
  "schema_version": "dps.legacy-zennodroid-entrypoints/v1",
  "inventory_scope": "ALL_ZDPROJECTS_CSHARP",
  "entry_count": 39,
  "entries": [
    {"path": "ZDProjects/DPS_CheckResult_OwnCode.cs", "classification": "PRODUCTION_FAIL_CLOSED", "production_loadable": true, "required_gate": "LEGACY_DISABLE_NEW_COMMANDS=true", "reason": "Production wrapper is retained only as a compiled fail-closed BadEnd route."},
    {"path": "ZDProjects/DPS_DecideAction_OwnCode.cs", "classification": "PRODUCTION_FAIL_CLOSED", "production_loadable": true, "required_gate": "LEGACY_DISABLE_NEW_COMMANDS=true", "reason": "Production wrapper is retained only as a compiled fail-closed BadEnd route."},
    {"path": "ZDProjects/DPS_Finalize_OwnCode.cs", "classification": "PRODUCTION_FAIL_CLOSED", "production_loadable": true, "required_gate": "LEGACY_DISABLE_NEW_COMMANDS=true", "reason": "Production wrapper is retained only as a compiled fail-closed BadEnd route."},
    {"path": "ZDProjects/DPS_Init_OwnCode.cs", "classification": "PRODUCTION_FAIL_CLOSED", "production_loadable": true, "required_gate": "LEGACY_DISABLE_NEW_COMMANDS=true", "reason": "Production wrapper is retained only as a compiled fail-closed BadEnd route."},
    {"path": "ZDProjects/DailyUpdate_OwnCode.cs", "classification": "PRODUCTION_FAIL_CLOSED", "production_loadable": true, "required_gate": "LEGACY_DISABLE_NEW_COMMANDS=true", "reason": "Unmigrated maintenance wrapper is disabled before dynamic source discovery."},
    {"path": "ZDProjects/Extension_OwnCode.cs", "classification": "PRODUCTION_FAIL_CLOSED", "production_loadable": true, "required_gate": "LEGACY_DISABLE_NEW_COMMANDS=true", "reason": "Unmigrated extension wrapper is disabled before dynamic source discovery."},
    {"path": "ZDProjects/Initializer_OwnCode.cs", "classification": "PRODUCTION_FAIL_CLOSED", "production_loadable": true, "required_gate": "LEGACY_DISABLE_NEW_COMMANDS=true", "reason": "Production wrapper is retained only as a compiled fail-closed BadEnd route."},
    {"path": "ZDProjects/Main_OwnCode.cs", "classification": "PRODUCTION_FAIL_CLOSED", "production_loadable": true, "required_gate": "LEGACY_DISABLE_NEW_COMMANDS=true", "reason": "Production wrapper is retained only as a compiled fail-closed BadEnd route."},
    {"path": "ZDProjects/Maintenance_OwnCode.cs", "classification": "PRODUCTION_FAIL_CLOSED", "production_loadable": true, "required_gate": "LEGACY_DISABLE_NEW_COMMANDS=true", "reason": "Unmigrated maintenance wrapper is disabled before dynamic source discovery."},
    {"path": "ZDProjects/ModuleLoader.cs", "classification": "DYNAMIC_LOADER_DISABLED", "production_loadable": false, "required_gate": "LEGACY_DYNAMIC_LOADER_DISABLED=true", "reason": "Variable-root CodeDom and reflection loading is forbidden in production."},
    {"path": "ZDProjects/PersonaCreate_OwnCode.cs", "classification": "PRODUCTION_FAIL_CLOSED", "production_loadable": true, "required_gate": "LEGACY_DISABLE_NEW_COMMANDS=true", "reason": "Unmigrated persona creation wrapper is disabled before dynamic source discovery."},
    {"path": "ZDProjects/RedditExplorerTest.cs", "classification": "QUARANTINE_ONLY_FIXTURE", "production_loadable": false, "required_gate": null, "reason": "Legacy device exploration fixture has no production authority."},
    {"path": "ZDProjects/Reddit_Browse.cs", "classification": "QUARANTINE_ONLY_FIXTURE", "production_loadable": false, "required_gate": null, "reason": "Legacy Reddit side-effect fragment is quarantined from production loading."},
    {"path": "ZDProjects/Reddit_Comment.cs", "classification": "QUARANTINE_ONLY_FIXTURE", "production_loadable": false, "required_gate": null, "reason": "Legacy comment path has uncertain postconditions and is fixture-only."},
    {"path": "ZDProjects/Reddit_Like.cs", "classification": "QUARANTINE_ONLY_FIXTURE", "production_loadable": false, "required_gate": null, "reason": "Legacy like path has uncertain postconditions and is fixture-only."},
    {"path": "ZDProjects/Reddit_ReadPost.cs", "classification": "QUARANTINE_ONLY_FIXTURE", "production_loadable": false, "required_gate": null, "reason": "Legacy read path has uncertain return-to-feed proof and is fixture-only."},
    {"path": "ZDProjects/ReportGen_OwnCode.cs", "classification": "PRODUCTION_FAIL_CLOSED", "production_loadable": true, "required_gate": "LEGACY_DISABLE_NEW_COMMANDS=true", "reason": "Unmigrated report wrapper is disabled before dynamic source discovery."},
    {"path": "ZDProjects/RuntimeTestRunner.cs", "classification": "QUARANTINE_ONLY_FIXTURE", "production_loadable": false, "required_gate": null, "reason": "Legacy runtime test harness cannot be part of a production source set."},
    {"path": "ZDProjects/SessionRunner_OwnCode.cs", "classification": "PRODUCTION_FAIL_CLOSED", "production_loadable": true, "required_gate": "LEGACY_DISABLE_NEW_COMMANDS=true", "reason": "Production wrapper is retained only as a compiled fail-closed BadEnd route."},
    {"path": "ZDProjects/StartReddit_OwnCode.cs", "classification": "PRODUCTION_FAIL_CLOSED", "production_loadable": true, "required_gate": "LEGACY_DISABLE_NEW_COMMANDS=true", "reason": "Device and app startup are disabled before DroidInstance access."},
    {"path": "ZDProjects/StateSaver_OwnCode.cs", "classification": "PRODUCTION_FAIL_CLOSED", "production_loadable": true, "required_gate": "LEGACY_DISABLE_NEW_COMMANDS=true", "reason": "Unmigrated state persistence wrapper is disabled before dynamic source discovery."},
    {"path": "ZDProjects/TestRunner.cs", "classification": "QUARANTINE_ONLY_FIXTURE", "production_loadable": false, "required_gate": null, "reason": "Legacy test DSL harness cannot be part of a production source set."},
    {"path": "ZDProjects/Tests/API_Quick_Check.cs", "classification": "QUARANTINE_ONLY_FIXTURE", "production_loadable": false, "required_gate": null, "reason": "Test fixture is excluded from production loading."},
    {"path": "ZDProjects/Tests/BabyCenter_E2E_Test.cs", "classification": "QUARANTINE_ONLY_FIXTURE", "production_loadable": false, "required_gate": null, "reason": "Test fixture is excluded from production loading."},
    {"path": "ZDProjects/Tests/Comment_Deep_Explore.cs", "classification": "QUARANTINE_ONLY_FIXTURE", "production_loadable": false, "required_gate": null, "reason": "Exploration fixture is excluded from production loading."},
    {"path": "ZDProjects/Tests/Comment_Structure_Explore.cs", "classification": "QUARANTINE_ONLY_FIXTURE", "production_loadable": false, "required_gate": null, "reason": "Exploration fixture is excluded from production loading."},
    {"path": "ZDProjects/Tests/Instagram_E2E_Test.cs", "classification": "QUARANTINE_ONLY_FIXTURE", "production_loadable": false, "required_gate": null, "reason": "Test fixture is excluded from production loading."},
    {"path": "ZDProjects/Tests/MultiPlatform_IntegrationTest.cs", "classification": "QUARANTINE_ONLY_FIXTURE", "production_loadable": false, "required_gate": null, "reason": "Test fixture is excluded from production loading."},
    {"path": "ZDProjects/Tests/Reddit_E2E_Test.cs", "classification": "QUARANTINE_ONLY_FIXTURE", "production_loadable": false, "required_gate": null, "reason": "Test fixture is excluded from production loading."},
    {"path": "ZDProjects/Tests/Reddit_IntegrationTest.cs", "classification": "QUARANTINE_ONLY_FIXTURE", "production_loadable": false, "required_gate": null, "reason": "Test fixture is excluded from production loading."},
    {"path": "ZDProjects/Tests/Reddit_XMLParsing_Library.cs", "classification": "QUARANTINE_ONLY_FIXTURE", "production_loadable": false, "required_gate": null, "reason": "Test support library is excluded from production loading."},
    {"path": "ZDProjects/Tests/ZennoDroid_AdvancedTest_OwnCode.cs", "classification": "QUARANTINE_ONLY_FIXTURE", "production_loadable": false, "required_gate": null, "reason": "Own Code test fixture is excluded from production loading."},
    {"path": "ZDProjects/Tests/ZennoDroid_CoreAPI_Explore.cs", "classification": "QUARANTINE_ONLY_FIXTURE", "production_loadable": false, "required_gate": null, "reason": "Exploration fixture is excluded from production loading."},
    {"path": "ZDProjects/Tests/ZennoDroid_DeepExplore_OwnCode.cs", "classification": "QUARANTINE_ONLY_FIXTURE", "production_loadable": false, "required_gate": null, "reason": "Own Code exploration fixture is excluded from production loading."},
    {"path": "ZDProjects/Tests/ZennoDroid_DroidInstance_Explore.cs", "classification": "QUARANTINE_ONLY_FIXTURE", "production_loadable": false, "required_gate": null, "reason": "Exploration fixture is excluded from production loading."},
    {"path": "ZDProjects/Tests/ZennoDroid_FeatureTest_Clean.cs", "classification": "QUARANTINE_ONLY_FIXTURE", "production_loadable": false, "required_gate": null, "reason": "Test fixture is excluded from production loading."},
    {"path": "ZDProjects/Tests/ZennoDroid_FeatureTest_OwnCode.cs", "classification": "QUARANTINE_ONLY_FIXTURE", "production_loadable": false, "required_gate": null, "reason": "Own Code test fixture is excluded from production loading."},
    {"path": "ZDProjects/Tests/ZennoDroid_KeyCode_Explore.cs", "classification": "QUARANTINE_ONLY_FIXTURE", "production_loadable": false, "required_gate": null, "reason": "Key injection exploration fixture is excluded from production loading."},
    {"path": "ZDProjects/WeeklyEvolve_OwnCode.cs", "classification": "PRODUCTION_FAIL_CLOSED", "production_loadable": true, "required_gate": "LEGACY_DISABLE_NEW_COMMANDS=true", "reason": "Unmigrated evolution wrapper is disabled before dynamic source discovery."}
  ],
  "unknown_entrypoint_behavior": "REJECT",
  "production_load_policy": "MANIFEST_EXACT_SET_ONLY",
  "limitations": [
    "This inventory is static repository evidence and does not prove which projects are installed in Windows ZennoDroid.",